pranav@pranav:/media/pranav/Pranav's Files/OSLAB-Github/Lab6$ python2 relocation.py -s 1

ARG seed 1
ARG address space size 1k
ARG phys mem size 16k

Base-and-Bounds register information:

  Base   : 0x0000363c (decimal 13884)
  Limit  : 290

Virtual Address Trace
  VA  0: 0x0000030e (decimal:  782) --> PA or segmentation violation?
  VA  1: 0x00000105 (decimal:  261) --> PA or segmentation violation?
  VA  2: 0x000001fb (decimal:  507) --> PA or segmentation violation?
  VA  3: 0x000001cc (decimal:  460) --> PA or segmentation violation?
  VA  4: 0x0000029b (decimal:  667) --> PA or segmentation violation?

For each virtual address, either write down the physical address it translates to
OR write down that it is an out-of-bounds address (a segmentation violation). For
this problem, you should assume a simple virtual address space of a given size.

pranav@pranav:/media/pranav/Pranav's Files/OSLAB-Github/Lab6$ python2 relocation.py -s 2

ARG seed 2
ARG address space size 1k
ARG phys mem size 16k

Base-and-Bounds register information:

  Base   : 0x00003ca9 (decimal 15529)
  Limit  : 500

Virtual Address Trace
  VA  0: 0x00000039 (decimal:   57) --> PA or segmentation violation?
  VA  1: 0x00000056 (decimal:   86) --> PA or segmentation violation?
  VA  2: 0x00000357 (decimal:  855) --> PA or segmentation violation?
  VA  3: 0x000002f1 (decimal:  753) --> PA or segmentation violation?
  VA  4: 0x000002ad (decimal:  685) --> PA or segmentation violation?

For each virtual address, either write down the physical address it translates to
OR write down that it is an out-of-bounds address (a segmentation violation). For
this problem, you should assume a simple virtual address space of a given size.

pranav@pranav:/media/pranav/Pranav's Files/OSLAB-Github/Lab6$ python2 relocation.py -s 3

ARG seed 3
ARG address space size 1k
ARG phys mem size 16k

Base-and-Bounds register information:

  Base   : 0x000022d4 (decimal 8916)
  Limit  : 316

Virtual Address Trace
  VA  0: 0x0000017a (decimal:  378) --> PA or segmentation violation?
  VA  1: 0x0000026a (decimal:  618) --> PA or segmentation violation?
  VA  2: 0x00000280 (decimal:  640) --> PA or segmentation violation?
  VA  3: 0x00000043 (decimal:   67) --> PA or segmentation violation?
  VA  4: 0x0000000d (decimal:   13) --> PA or segmentation violation?

For each virtual address, either write down the physical address it translates to
OR write down that it is an out-of-bounds address (a segmentation violation). For
this problem, you should assume a simple virtual address space of a given size.

=======================================================================================================================
pranav@pranav:/media/pranav/Pranav's Files/OSLAB-Github/Lab6$ python2 relocation.py -s 1 -c

ARG seed 1
ARG address space size 1k
ARG phys mem size 16k

Base-and-Bounds register information:

  Base   : 0x0000363c (decimal 13884)
  Limit  : 290

Virtual Address Trace
  VA  0: 0x0000030e (decimal:  782) --> SEGMENTATION VIOLATION
  VA  1: 0x00000105 (decimal:  261) --> VALID: 0x00003741 (decimal: 14145)
  VA  2: 0x000001fb (decimal:  507) --> SEGMENTATION VIOLATION
  VA  3: 0x000001cc (decimal:  460) --> SEGMENTATION VIOLATION
  VA  4: 0x0000029b (decimal:  667) --> SEGMENTATION VIOLATION

pranav@pranav:/media/pranav/Pranav's Files/OSLAB-Github/Lab6$ python2 relocation.py -s 2 -c

ARG seed 2
ARG address space size 1k
ARG phys mem size 16k

Base-and-Bounds register information:

  Base   : 0x00003ca9 (decimal 15529)
  Limit  : 500

Virtual Address Trace
  VA  0: 0x00000039 (decimal:   57) --> VALID: 0x00003ce2 (decimal: 15586)
  VA  1: 0x00000056 (decimal:   86) --> VALID: 0x00003cff (decimal: 15615)
  VA  2: 0x00000357 (decimal:  855) --> SEGMENTATION VIOLATION
  VA  3: 0x000002f1 (decimal:  753) --> SEGMENTATION VIOLATION
  VA  4: 0x000002ad (decimal:  685) --> SEGMENTATION VIOLATION
  
pranav@pranav:/media/pranav/Pranav's Files/OSLAB-Github/Lab6$ python2 relocation.py -s 3 -c

ARG seed 3
ARG address space size 1k
ARG phys mem size 16k

Base-and-Bounds register information:

  Base   : 0x000022d4 (decimal 8916)
  Limit  : 316

Virtual Address Trace
  VA  0: 0x0000017a (decimal:  378) --> SEGMENTATION VIOLATION
  VA  1: 0x0000026a (decimal:  618) --> SEGMENTATION VIOLATION
  VA  2: 0x00000280 (decimal:  640) --> SEGMENTATION VIOLATION
  VA  3: 0x00000043 (decimal:   67) --> VALID: 0x00002317 (decimal: 8983)
  VA  4: 0x0000000d (decimal:   13) --> VALID: 0x000022e1 (decimal: 8929)

